{
  "id":"VE-P-ELVIS-AMOROSO","name":"Elvis Eduardo Hidrobo Amoroso","name_variants":["Elvis Amoroso"],"nationality":["VE"],
  "public_positions":[{"title":"Presidente del Consejo Nacional Electoral y de la Junta Nacional Electoral","institution":"Consejo Nacional Electoral","start_date":"2023-08-25","sources":["VE-2023-CNE-RESOLUTION-230825-098"]}],
  "sources":[{"url":"https://apv-registro.github.io/archivo-publico-venezuela/documents/VE-2023-CNE-RESOLUTION-230825-098-P1.webp","publisher":"Consejo Nacional Electoral, Gaceta Electoral 1.028","retrieved_at":"2026-08-09T09:20:00Z"},{"url":"https://apv-registro.github.io/archivo-publico-venezuela/documents/VE-2024-RNV-CNE-SECOND-BULLETIN-2024-08-02.html","publisher":"Radio Nacional de Venezuela","retrieved_at":"2026-08-08T15:04:32Z"}],
  "identity_notes":"Leyó y atribuyó públicamente los resultados y compareció por el CNE ante la Sala Electoral."
}
