{
  "id":"VE-P-FANNY-MARQUEZ","name":"Fanny Beatriz Márquez Cordero","name_variants":["Fanny Márquez"],"nationality":["VE"],
  "public_positions":[{"title":"Magistrada principal de la Sala Electoral","institution":"Tribunal Supremo de Justicia","start_date":"2022-04-27","sources":["VE-2022-GACETA-6696-TSJ-MAGISTRATES:p.2"]}],
  "sources":[{"url":"https://apv-registro.github.io/archivo-publico-venezuela/documents/VE-2022-GACETA-6696-TSJ-MAGISTRATES.pdf","publisher":"Gaceta Oficial de la República Bolivariana de Venezuela","retrieved_at":"2026-08-08T15:04:32Z"},{"url":"https://apv-registro.github.io/archivo-publico-venezuela/documents/EU-2025-DECISION-2025-49.pdf","publisher":"Unión Europea","retrieved_at":"2026-08-08T15:04:32Z"}],
  "identity_notes":"La Decisión (PESC) 2025/49, entrada 57, le atribuye participación en la certificación del resultado."
}
