{
  "id": "VE-P-CARYSLIA-RODRIGUEZ",
  "name": "Caryslia Beatriz Rodríguez Rodríguez",
  "name_variants": ["Caryslia Rodríguez"],
  "birth_date": "1967-07-16",
  "nationality": ["VE"],
  "public_positions": [{
    "title": "Presidenta del Tribunal Supremo de Justicia y de la Sala Electoral",
    "institution": "Tribunal Supremo de Justicia",
    "start_date": "2024-01-01",
    "sources": ["EU-2025-REG-2025-44, entrada 56"]
  }],
  "sources": [{
    "url": "https://www.boe.es/doue/2025/044/L00001-00009.pdf",
    "publisher": "Consejo de la Unión Europea",
    "retrieved_at": "2026-08-08T00:00:00Z"
  }],
  "identity_notes": "Identificación y función según la entrada 56 del Reglamento de Ejecución (UE) 2025/44."
}
